{
  "schemaVersion": 1,
  "revision": 5,
  "apps": [
    {
      "id": "pdf-viewer",
      "name": "PDF 뷰어",
      "path": "apps/pdf-viewer.json",
      "sha256": "739fdb18d93b143ffe6598c26177be73794f12052ad6018eca24d1912cbf22a8",
      "match": {
        "macos": {
          "bundleIds": [
            "com.apple.Preview",
            "com.adobe.Reader"
          ]
        },
        "windows": {
          "executables": [
            "AcroRd32.exe",
            "Acrobat.exe"
          ]
        },
        "linux": {
          "desktopIds": [
            "org.gnome.Evince",
            "org.gnome.Evince.desktop",
            "org.kde.okular",
            "org.kde.okular.desktop"
          ],
          "wmClasses": [
            "evince",
            "Evince",
            "okular",
            "Okular"
          ]
        }
      }
    },
    {
      "id": "music-app",
      "name": "음악 앱",
      "path": "apps/music-app.json",
      "sha256": "4884b22512081e176886b2c65b32e314839a2aa758c958833a6a1e39509248c6",
      "match": {
        "macos": {
          "bundleIds": [
            "com.apple.Music",
            "com.spotify.client"
          ]
        },
        "windows": {
          "executables": [
            "AppleMusic.exe",
            "Spotify.exe"
          ]
        },
        "linux": {
          "desktopIds": [
            "spotify",
            "spotify.desktop",
            "com.spotify.Client",
            "com.spotify.Client.desktop"
          ],
          "wmClasses": [
            "spotify",
            "Spotify"
          ]
        }
      }
    }
  ],
  "boards": [
    {
      "id": "arduino.uno-r3-ch340",
      "name": "Arduino Uno R3 호환 보드 (CH340)",
      "manifest": "boards/arduino-uno-r3-ch340.json",
      "sha256": "8e20a9e6d5a7b187dd5a60b4bdec0229d796d9e413febfa37877c13cab568861",
      "detect": {
        "usb": [
          {
            "vid": "1a86",
            "pid": "7523",
            "confidence": "ambiguous"
          },
          {
            "vid": "1a86",
            "pid": "7522",
            "confidence": "ambiguous"
          },
          {
            "vid": "1a86",
            "pid": "5523",
            "confidence": "ambiguous"
          }
        ]
      }
    },
    {
      "id": "arduino.uno-r3",
      "name": "Arduino Uno R3",
      "manifest": "boards/arduino-uno-r3.json",
      "sha256": "8dcdc7641e20059e4212febe016d8bc1f044320f0057a0d5b8f48afe34ae2227",
      "detect": {
        "usb": [
          {
            "vid": "2341",
            "pid": "0043",
            "confidence": "exact",
            "manufacturerAliases": [
              "Arduino",
              "Arduino LLC",
              "Arduino (www.arduino.cc)"
            ],
            "productAliases": [
              "Arduino Uno",
              "Arduino Uno R3",
              "Arduino Uno Rev3"
            ]
          },
          {
            "vid": "2341",
            "pid": "0001",
            "confidence": "exact",
            "manufacturerAliases": [
              "Arduino",
              "Arduino LLC",
              "Arduino (www.arduino.cc)"
            ],
            "productAliases": [
              "Arduino Uno",
              "Arduino Uno R3",
              "Arduino Uno Rev3"
            ]
          },
          {
            "vid": "2a03",
            "pid": "0043",
            "confidence": "exact",
            "manufacturerAliases": [
              "Arduino",
              "Arduino SRL",
              "Arduino (www.arduino.cc)"
            ],
            "productAliases": [
              "Arduino Uno",
              "Arduino Uno R3",
              "Arduino Uno Rev3"
            ]
          },
          {
            "vid": "2341",
            "pid": "0243",
            "confidence": "exact",
            "manufacturerAliases": [
              "Arduino",
              "Arduino LLC",
              "Arduino (www.arduino.cc)"
            ],
            "productAliases": [
              "Arduino Uno",
              "Arduino Uno R3",
              "Arduino Uno Rev3"
            ]
          },
          {
            "vid": "2341",
            "pid": "006a",
            "confidence": "exact",
            "manufacturerAliases": [
              "Arduino",
              "Arduino LLC",
              "Arduino (www.arduino.cc)"
            ],
            "productAliases": [
              "Arduino Uno",
              "Arduino Uno R3",
              "Arduino Uno Rev3"
            ]
          }
        ]
      }
    },
    {
      "id": "seeed.xiao-nrf52840-sense",
      "name": "Seeed XIAO nRF52840 Sense",
      "manifest": "boards/seeed-xiao-nrf52840-sense.json",
      "sha256": "26a1343441e6be05f9e3506101e9d7adc157e5e2bdd3899751ae2a5e68fbfccb",
      "detect": {
        "usb": [
          {
            "vid": "2886",
            "pid": "8045",
            "confidence": "exact",
            "manufacturerAliases": [
              "Seeed Studio"
            ],
            "productAliases": [
              "XIAO nRF52840 Sense"
            ]
          },
          {
            "vid": "2886",
            "pid": "0045",
            "confidence": "exact",
            "manufacturerAliases": [
              "Seeed Studio"
            ],
            "productAliases": [
              "XIAO nRF52840 Sense"
            ]
          }
        ]
      }
    }
  ]
}
